+----+---------+--------+--------------+---------+------------+-----------+------------+-------------+-----+---------+------------+
| id | name    | gender | phone_number | address | department | basic_pay | deductions | taxable_pay | tax | net_pay | start      |
+----+---------+--------+--------------+---------+------------+-----------+------------+-------------+-----+---------+------------+
|  1 | Swayam  | M      | NULL         | NULL    |            |     35000 |          0 |           0 |   0 |       0 | 2022-08-15 |
|  2 | Prakash | M      | NULL         | NULL    |            |     30000 |          0 |           0 |   0 |       0 | 2021-09-21 |
|  3 | Shivam  | M      | NULL         | NULL    |            |     45000 |          0 |           0 |   0 |       0 | 2019-09-25 |
|  4 | Rahul   | M      | NULL         | NULL    |            |     41000 |          0 |           0 |   0 |       0 | 2018-07-01 |
+----+---------+--------+--------------+---------+------------+-----------+------------+-------------+-----+---------+------------+
4 rows in set (0.01 sec)

mysql> insert into employee_payroll values (5, 'Terissa', 'F', '8965231472', 'New York', 'Sales and Marketing', 88000, 8000, 80000, 16000, 64000, '2015-01-02');
Query OK, 1 row affected (0.05 sec)

mysql> insert into employee_payroll values (6, 'Terissa', 'F', '8965231472', 'New York', 'HR', 88000, 8000, 80000, 16000, 64000, '2015-01-02');
Query OK, 1 row affected (0.01 sec)

mysql> update employee_payroll set address ='Ranchi', department='Marketing', phone_number = '95823641785', net_pay = '35000' where name = 'Swayam';
Query OK, 1 row affected (0.02 sec)
Rows matched: 1  Changed: 1  Warnings: 0

mysql> select * from employee_payroll;
+----+---------+--------+--------------+----------+---------------------+-----------+------------+-------------+-------+---------+------------+
| id | name    | gender | phone_number | address  | department          | basic_pay | deductions | taxable_pay | tax   | net_pay | start      |
+----+---------+--------+--------------+----------+---------------------+-----------+------------+-------------+-------+---------+------------+
|  1 | Swayam  | M      | 95823641785  | Ranchi   | Marketing           |     35000 |          0 |           0 |     0 |   35000 | 2022-08-15 |
|  2 | Prakash | M      | NULL         | NULL     |                     |     30000 |          0 |           0 |     0 |       0 | 2021-09-21 |
|  3 | Shivam  | M      | NULL         | NULL     |                     |     45000 |          0 |           0 |     0 |       0 | 2019-09-25 |
|  4 | Rahul   | M      | NULL         | NULL     |                     |     41000 |          0 |           0 |     0 |       0 | 2018-07-01 |
|  5 | Terissa | F      | 8965231472   | New York | Sales and Marketing |     88000 |       8000 |       80000 | 16000 |   64000 | 2015-01-02 |
|  6 | Terissa | F      | 8965231472   | New York | HR                  |     88000 |       8000 |       80000 | 16000 |   64000 | 2015-01-02 |
+----+---------+--------+--------------+----------+---------------------+-----------+------------+-------------+-------+---------+------------+
6 rows in set (0.00 sec)

mysql>